{
  "$meta": {
    "schemaVersion": "1.0.0-alpha",
    "generatedAt": "2026-06-10T18:00:00.000Z",
    "generatedBy": "manual-catalog-expansion",
    "sourceFiles": [
      "src/data/provider-comparisons.seed.json",
      "scripts/extract-provider-comparisons.cjs",
      "nest/src/modules/providers/adapters/trading212.adapter.ts",
      "nest/src/modules/providers/adapters/alpaca.adapter.ts",
      "nest/src/modules/providers/adapters/alpha-vantage.adapter.ts",
      "nest/src/modules/providers/interfaces/provider-adapter.interface.ts",
      "docs/TRADING212-IMPLEMENTATION-PROGRESS.md",
      "docs/DATA-ELEMENTS-SPECIFICATION.md"
    ],
    "confidenceScoring": {
      "confirmed": "Verified against provider docs or live API testing.",
      "likely": "Inferred from known patterns, public docs, or community sources but not directly tested.",
      "uncertain": "Best-guess based on limited information; needs verification.",
      "unknown": "Explicitly unknown; field is null with a reason."
    }
  },
  "providers": {
    "trading212": {
      "providerId": "trading212",
      "displayName": "Trading 212",
      "providerType": "brokerage",
      "adapterStatus": {
        "implemented": true,
        "adapterFile": "nest/src/modules/providers/adapters/trading212.adapter.ts",
        "methodsImplemented": ["getQuote", "getCandles", "getProfile", "healthCheck"],
        "isMockOnly": true
      },
      "auth": {
        "method": "api_key_header",
        "credentialFields": ["TRADING212_API_KEY"],
        "headerName": "Authorization",
        "tokenPrefix": null,
        "confidence": "confirmed"
      },
      "environments": {
        "paper": "https://demo.trading212.com/api/v0",
        "live": "https://live.trading212.com/api/v0"
      },
      "rateLimitProfile": {
        "freeTier": {
          "requestsPerMinute": null,
          "requestsPerDay": null,
          "notes": "No free tier — requires funded account"
        },
        "paidTier": {
          "requestsPerMinute": 60,
          "requestsPerDay": null,
          "notes": "Per API key; exact limits undocumented publicly"
        },
        "notes": "Rate limits inferred from community reports; Trading212 does not publish explicit rate-limit docs. Confidence: uncertain."
      },
      "freshnessSLA": {
        "expectedLatencyMs": 1500,
        "staleThresholdMinutes": 5,
        "updateFrequency": "per_second",
        "marketHoursOnly": false,
        "confidence": "likely"
      },
      "endpoints": [
        {
          "id": "get_account_info",
          "method": "GET",
          "path": "/equity/account/info",
          "category": "account",
          "displayName": "Account Info",
          "description": "Returns account balance, currency, and status.",
          "payloadClass": "account_info",
          "parameters": {
            "required": [],
            "optional": []
          },
          "rateLimitCategory": "t212_standard",
          "freshnessSLA": { "expectedLatencyMs": 500, "staleThresholdMinutes": 5, "updateFrequency": "on_demand", "marketHoursOnly": false, "confidence": "likely" },
          "paginationSupport": "none",
          "confidence": "confirmed"
        },
        {
          "id": "get_portfolio",
          "method": "GET",
          "path": "/equity/portfolio",
          "category": "portfolio",
          "displayName": "Portfolio Positions",
          "description": "Returns all open positions with quantity, average price, P&L.",
          "payloadClass": "portfolio_positions",
          "parameters": {
            "required": [],
            "optional": []
          },
          "rateLimitCategory": "t212_standard",
          "freshnessSLA": { "expectedLatencyMs": 1000, "staleThresholdMinutes": 2, "updateFrequency": "per_second", "marketHoursOnly": false, "confidence": "confirmed" },
          "paginationSupport": "none",
          "confidence": "confirmed"
        },
        {
          "id": "get_instruments",
          "method": "GET",
          "path": "/equity/metadata/instruments",
          "category": "reference",
          "displayName": "Instrument List",
          "description": "Returns available instruments (tickers, ISINs, types).",
          "payloadClass": "instrument_list",
          "parameters": {
            "required": [],
            "optional": []
          },
          "rateLimitCategory": "t212_standard",
          "freshnessSLA": { "expectedLatencyMs": 2000, "staleThresholdMinutes": 1440, "updateFrequency": "eod", "marketHoursOnly": false, "confidence": "likely" },
          "paginationSupport": "none",
          "confidence": "confirmed"
        },
        {
          "id": "get_order_list",
          "method": "GET",
          "path": "/equity/orders",
          "category": "order_management",
          "displayName": "Order List",
          "description": "Returns pending and historical orders.",
          "payloadClass": "order_list",
          "parameters": {
            "required": [],
            "optional": [
              { "name": "cursor", "type": "string", "description": "Pagination cursor from previous response." },
              { "name": "ticker", "type": "string", "description": "Filter by ticker symbol." },
              { "name": "limit", "type": "integer", "description": "Max orders to return (default 20).", "min": 1, "max": 50 }
            ]
          },
          "rateLimitCategory": "t212_standard",
          "freshnessSLA": { "expectedLatencyMs": 500, "staleThresholdMinutes": 1, "updateFrequency": "realtime", "marketHoursOnly": false, "confidence": "confirmed" },
          "paginationSupport": "cursor",
          "maxPageSize": 50,
          "confidence": "confirmed"
        },
        {
          "id": "post_order_limit",
          "method": "POST",
          "path": "/equity/orders/limit",
          "category": "order_management",
          "displayName": "Place Limit Order",
          "description": "Places a limit order for an instrument.",
          "payloadClass": "order_confirmation",
          "parameters": {
            "required": [
              { "name": "ticker", "type": "string", "description": "Instrument ticker symbol." },
              { "name": "quantity", "type": "number", "description": "Number of shares/units." },
              { "name": "limitPrice", "type": "number", "description": "Limit price for the order." },
              { "name": "action", "type": "enum", "enumValues": ["BUY", "SELL"], "description": "Direction of the order." }
            ],
            "optional": [
              { "name": "timeValidity", "type": "enum", "enumValues": ["DAY", "GTC"], "description": "Order duration. Default DAY." }
            ]
          },
          "rateLimitCategory": "t212_order_write",
          "freshnessSLA": { "expectedLatencyMs": 2000, "staleThresholdMinutes": 0, "updateFrequency": "on_demand", "marketHoursOnly": false, "confidence": "confirmed" },
          "paginationSupport": "none",
          "confidence": "confirmed"
        },
        {
          "id": "post_order_market",
          "method": "POST",
          "path": "/equity/orders/market",
          "category": "order_management",
          "displayName": "Place Market Order",
          "description": "Places a market order for an instrument.",
          "payloadClass": "order_confirmation",
          "parameters": {
            "required": [
              { "name": "ticker", "type": "string" },
              { "name": "quantity", "type": "number" },
              { "name": "action", "type": "enum", "enumValues": ["BUY", "SELL"] }
            ],
            "optional": []
          },
          "rateLimitCategory": "t212_order_write",
          "freshnessSLA": { "expectedLatencyMs": 2000, "staleThresholdMinutes": 0, "updateFrequency": "on_demand", "marketHoursOnly": false, "confidence": "confirmed" },
          "paginationSupport": "none",
          "confidence": "confirmed"
        },
        {
          "id": "post_order_stop",
          "method": "POST",
          "path": "/equity/orders/stop",
          "category": "order_management",
          "displayName": "Place Stop Order",
          "description": "Places a stop-loss or stop-entry order.",
          "payloadClass": "order_confirmation",
          "parameters": {
            "required": [
              { "name": "ticker", "type": "string" },
              { "name": "quantity", "type": "number" },
              { "name": "stopPrice", "type": "number" },
              { "name": "action", "type": "enum", "enumValues": ["BUY", "SELL"] }
            ],
            "optional": [
              { "name": "limitPrice", "type": "number", "description": "Optional limit price for stop-limit orders." }
            ]
          },
          "rateLimitCategory": "t212_order_write",
          "freshnessSLA": { "expectedLatencyMs": 2000, "staleThresholdMinutes": 0, "updateFrequency": "on_demand", "marketHoursOnly": false, "confidence": "confirmed" },
          "paginationSupport": "none",
          "confidence": "confirmed"
        },
        {
          "id": "delete_order",
          "method": "DELETE",
          "path": "/equity/orders/{orderId}",
          "category": "order_management",
          "displayName": "Cancel Order",
          "description": "Cancels a pending order by ID.",
          "payloadClass": "order_confirmation",
          "parameters": {
            "required": [
              { "name": "orderId", "type": "string", "description": "Order ID returned from order placement." }
            ],
            "optional": []
          },
          "rateLimitCategory": "t212_order_write",
          "freshnessSLA": { "expectedLatencyMs": 1000, "staleThresholdMinutes": 0, "updateFrequency": "on_demand", "marketHoursOnly": false, "confidence": "confirmed" },
          "paginationSupport": "none",
          "confidence": "confirmed"
        },
        {
          "id": "get_historical_bars",
          "method": "GET",